"id","inqno","fdate","remark","ndate","datetime","user_id"
"2489","3861","2021-10-02","Firm Requirements for HPCL Project. It is under technical evaluation.","2021-10-20","2021-10-02 16:37:31.398351","3011"
"2490","3185","2021-10-02","Firm Requirements for Nayara Energy Project","2021-10-15","2021-10-02 17:28:37.945433","3011"
"2491","3651","2021-10-02","AST has given their target prices. Submitted our Revised offer on 30.09.21. It is under fiollow-up.","2021-10-11","2021-10-02 17:48:50.957409","3011"
"2492","3589","2021-10-02","Submitted our Revised offer the value of Rs.1.38 Cr. on 30.09.21.","2021-10-15","2021-10-02 17:52:58.635458","3011"
"2493","3401","2021-10-02","Firm Requirements for HRRL Project. It is under follow-up.","2021-10-07","2021-10-02 17:58:27.693065","3011"
"2494","3932","2021-10-05","Commercial offer submitted / Under follow up","2021-10-11","2021-10-05 11:23:14.123331","3048"
"2495","2453","2021-10-06","Bid is not opened yet.   ","2021-10-30","2021-10-06 16:45:13.145273","3033"
"2496","3413","2021-10-06","Not open yet.  ","2021-10-30","2021-10-06 16:46:06.027284","3033"
"2497","3866","2021-10-06","We have submitted offer and ttr of BSPTCL.","2021-10-11","2021-10-06 16:56:10.017002","3044"
"2498","3798","2021-10-06","We have submitted offer and they insist for the 180 days vendor discounting payment terms.","2021-10-11","2021-10-06 16:58:58.617088","3044"
"2499","3767","2021-10-06","It will take some time. they will let us know about finalisation.","2021-10-19","2021-10-06 16:59:43.411041","3044"
"2500","3726","2021-10-06","We have submitted TTR of PGCIL for the consideration.","2021-10-14","2021-10-06 17:00:35.486055","3044"
"2501","3719","2021-10-06","They will close this within 15 days.","2021-10-14","2021-10-06 17:01:13.242078","3044"
"2502","3575","2021-10-06"," Our offer technically evaluated. Mail confirmation received from them.","2021-10-15","2021-10-06 17:02:20.547136","3044"
"2503","3525","2021-10-06","RA was conducted 27-september, We have submitted revised rate date.6-10-21.","2021-10-12","2021-10-06 17:06:52.046140","3044"
"2504","3561","2021-10-06","under follow up.","2021-10-12","2021-10-06 17:10:00.401174","3044"
"2505","3311","2021-10-06","They are waiting for the confirmation from ONGC for the procurement of cables.","2021-10-12","2021-10-06 17:18:08.935329","3044"
"2506","3266","2021-10-06","They will provide us revised BOQ.","2021-10-14","2021-10-06 17:18:35.424336","3044"
"2507","3194","2021-10-06","They will provide us revised BOQ.","2021-10-14","2021-10-06 17:20:14.057311","3044"
"2508","2855","2021-10-06","Project hold for the uncertain reason.","2021-10-20","2021-10-06 17:29:36.017426","3044"
"2509","3700","2021-10-07","GTP sent, Finalizations will be done next week. ","2021-10-13","2021-10-07 11:44:38.700816","3033"
"2510","3987","2021-10-11","Commercial offer submitted ","2021-10-12","2021-10-11 09:41:36.451474","3048"
"2511","21","2021-10-14","They have provided revised BOQ, we shall submit datasheet for the technical clearance.","2021-10-20","2021-10-14 12:20:58.917953","3044"
"2512","3401","2021-10-14","Lost it on high rates. No further information.","2021-10-01","2021-10-14 16:34:39.508302","3011"
"2513","3913","2021-10-14","Firm Requirements for Vihama -Ghana Project.  Teams meeting was conducted.","2021-10-04","2021-10-14 16:43:00.755786","3011"
"2514","3913","2021-10-01","Lost it on high rates. Cords has got it.","2021-10-11","2021-10-14 16:44:38.065170","3011"
"2515","3589","2021-10-01","Teams was conducted. Lost it on high rates. Cords have got it.","2021-10-05","2021-10-14 16:48:52.070358","3011"
"2516","3651","2021-10-05","Teams meeting was conducted. Lost it on high rates. Cords have got it.","2021-10-11","2021-10-14 17:15:59.848366","3011"
"2517","3762","2021-10-18","We have submitted revised rates as per the current market rates.","2021-10-22","2021-10-18 11:34:53.861230","3044"
"2518","3948","2021-10-18","Firm Requirements. They ask for technical datasheet.","2021-10-25","2021-10-18 18:05:10.224889","3011"
"2519","1688","2021-10-19","Offer sent please still open not closed,.  ","2021-11-01","2021-10-19 17:27:54.454924","3033"
"2520","3428","2021-10-19","Have discussed with project team , recommendation was gibe purchase still no reply.  Under follow up.  ","2021-11-01","2021-10-19 17:32:54.545415","3033"
"2521","3434","2021-10-20","An order confirmation is received.","2021-10-31","2021-10-20 18:04:17.626231","3011"
"2522","4020","2021-10-22","Commercial offer submitted","2021-10-27","2021-10-22 14:46:51.730690","3048"
"2523","4019","2021-10-22","Commercial offer submitted / Under follow up","2021-10-28","2021-10-22 14:48:00.968804","3048"
"2524","4010","2021-10-22","Commercial offer submitted / we have to submit revised as per revised technical / Under follow up","2021-10-26","2021-10-22 14:53:43.041673","3048"
"2525","3980","2021-10-22","Budgetary offer submitted / It will take some time ","2021-11-08","2021-10-22 14:54:37.505038","3048"
"2526","3954","2021-10-22","Commercial offer submitted / under follow up ","2021-10-25","2021-10-22 15:00:31.908527","3048"
"2527","4038","2021-10-22","Offer sent for 3 day validity.  ","2021-10-27","2021-10-22 15:00:48.158729","3033"
"2528","4094","2021-10-22","Offer has been submitted and it is under negotiation. They might close it today itself.","2021-10-22","2021-10-22 15:01:14.537718","3053"
"2529","3935","2021-10-22","Budgetary offer submitted ","2021-11-15","2021-10-22 15:03:59.971065","3048"
"2530","4051","2021-10-22","They will issue po to the L1 quote. ","2021-10-27","2021-10-22 15:13:52.937899","3044"
"2531","4023","2021-10-22","Budgetary offer ,it will take time.","2021-12-16","2021-10-22 15:16:18.264920","3044"
"2532","4007","2021-10-22","budgetary offer, it will take time.","2021-11-23","2021-10-22 15:16:53.202999","3044"
"2533","3918","2021-10-22","Commercial offer with technical data sheet submitted / Under follow up","2021-10-27","2021-10-22 15:19:02.363371","3048"
"2534","3922","2021-10-22","Commercial offer submitted / It is under follow up","2021-10-29","2021-10-22 15:19:58.168493","3048"
"2535","3932","2021-10-22","Not finalized yet / under follow up","2021-10-26","2021-10-22 15:23:02.132936","3048"
"2536","3916","2021-10-22","Commercial offer submitted / under follow up","2021-10-28","2021-10-22 15:24:34.308508","3048"
"2537","4001","2021-10-22","We have submitted technical datasheet for the technical clearance.","2021-10-27","2021-10-22 15:27:11.030456","3044"
"2538","3893","2021-10-22","Commercial offer submitted / under follow up","2021-10-29","2021-10-22 15:28:37.773385","3048"
"2539","3185","2021-10-22","We have quoted rates for min. qty.1000 Mtrs wherein qty. is less then 500 Mtrs which is not acceptable by TOYO.. Finally, It has finalized on Associated cables due to high rates. Closed on 05.10.21.","2021-10-25","2021-10-22 16:06:40.301738","3011"
"2540","3985","2021-10-22","They will intimate us before finalization. Expecting they will close with in 10 days.  ","2021-10-27","2021-10-22 16:27:03.900386","3044"
"2541","3940","2021-10-22","We have submitted our rates along with terms and conditions.","2021-10-27","2021-10-22 16:38:56.215319","3044"
"2542","3942","2021-10-22","It will take time.","2021-11-25","2021-10-22 16:39:43.312843","3044"
"2543","3790","2021-10-22","It will take time.","2021-11-25","2021-10-22 16:41:34.544516","3044"
"2544","3867","2021-10-22","Commercial offer submitted / Under follow up","2021-10-29","2021-10-22 17:32:53.718623","3048"
"2545","3862","2021-10-22","It us under follow up","2021-10-26","2021-10-22 17:34:05.154732","3048"
"2546","4085","2021-10-25","Offer has been submitted and it shall get finalised soon. They are under follow up","2021-11-20","2021-10-25 11:18:15.299107","3053"
"2547","4086","2021-10-25","We have submitted the offer and they are under follow up.","2021-11-22","2021-10-25 11:19:01.564082","3053"
"2548","4073","2021-10-25","  After a meeting they had provided a sample and we submitted the offer for the cables. It shall be finalised after diwali as discussed with Dilip sir.","2021-11-18","2021-10-25 11:51:17.021539","3053"
"2549","2355","2021-10-25","We have been constantly following up with then but till date no proper reply from them.  ","2021-10-06","2021-10-25 12:02:01.834850","3033"
"2550","4025","2021-10-25","COmmercial offer submitted / Under follow up","2021-10-30","2021-10-25 18:13:18.361221","3048"
"2551","4050","2021-10-25","Commercial offer submitted / Under follow up by mail and call","2021-10-30","2021-10-25 18:14:10.463359","3048"
"2552","4125","2021-10-26","It will take time.","2021-11-25","2021-10-26 17:46:56.660512","3044"
"2553","4121","2021-10-26"," It will take time.","2021-11-25","2021-10-30 10:23:18.915884","3044"
"2554","4120","2021-10-26"," We have submitted rates and they will consider us for the finalization.","2021-11-01","2021-10-26 17:48:29.659967","3044"
"2555","4119","2021-10-26","We have submitted datasheet for the technical approval.","2021-11-10","2021-10-26 17:49:02.557429","3044"
"2556","4118","2021-10-26","It will take time.","2021-11-24","2021-10-26 17:49:27.173456","3044"
"2557","4104","2021-10-26","It will take time.","2021-11-30","2021-10-26 17:53:02.603658","3044"
"2558","4089","2021-10-26","We have submitted rates ,they will intimate us for the finalization.","2021-11-11","2021-10-26 17:53:58.471504","3044"
"2559","4083","2021-10-26","They will appoint Yash EPC as a contractor for this project.","2021-11-16","2021-10-26 17:55:25.040102","3044"
"2560","3986","2021-10-26","It is under technical evaluation.","2021-11-11","2021-10-26 18:31:30.692158","3044"
"2561","3866","2021-10-26","They will provide us revised quantity as per site requirements. ","2021-11-16","2021-10-26 18:50:46.860039","3044"
"2562","3838","2021-10-26","It will take time.","2021-11-17","2021-10-26 18:51:16.304874","3044"
"2563","3791","2021-10-26","It will take time.","2021-11-24","2021-10-26 18:51:57.272453","3044"
"2564","3966","2021-10-26","Offer is budgetary and they shall let us know when the bidding is completed and they get thee results","2021-11-30","2021-10-26 19:05:28.946432","3053"
"2565","3909","2021-10-26","Inquiry received through Pratik bhai as we buy some material from them. They carry out cathodic protection projects for o","2021-11-15","2021-10-26 19:11:59.544198","3053"
"2566","3735","2021-10-26","Discussed with Divakar again, They shall finalise after diwali due to raw material hike. They require revised quotation as per their revised BOQ.","2021-11-15","2021-10-26 19:13:33.555805","3053"
"2567","4116","2021-10-27","Offer has been submitted and it is a for bidding in Chemical company. It shall take time to get finalised.","2021-12-01","2021-10-27 10:19:18.452869","3053"
"2568","3653","2021-10-27","They required GTP","2021-11-15","2021-10-27 10:36:14.886776","3053"
"2569","3963","2021-10-28","We have submitted our rates as per the current market rates.","2021-11-02","2021-10-28 14:41:39.240810","3044"
"2570","3962","2021-10-28","This contains small cut lengths. ","2021-11-01","2021-10-28 14:42:59.341318","3044"
"2571","3946","2021-10-28","They are waiting for the clearance from the HPCL ","2021-11-02","2021-10-28 14:43:34.126387","3044"
"2572","4148","2021-10-28","We have submitted offer ","2021-11-10","2021-10-28 14:44:05.788649","3033"
"2573","3472","2021-10-28","We have submitted offer under follow up.  ","2021-10-12","2021-10-28 15:34:58.563632","3033"
"2574","3914","2021-10-28","It will take time.","2021-12-24","2021-10-28 15:35:46.519315","3044"
"2575","3787","2021-10-28","It will take time.","2021-12-23","2021-10-28 15:37:08.463969","3044"
"2576","3529","2021-10-28","It will take time.","2021-11-25","2021-10-28 15:41:59.071462","3044"
"2577","3337","2021-10-28","It is in under technical evaluation.","2021-11-30","2021-10-28 16:09:12.150562","3044"
"2578","3948","2021-10-28","Still It is under technical evaluation. Contact in Nov.21.","2021-11-05","2021-10-28 16:27:21.002276","3011"
"2579","3933","2021-10-28","Firm Requirements for Adani Mundra Project. Sterling shall conduct RA.","2021-11-05","2021-10-28 16:49:24.707668","3011"
"2580","2868","2021-10-28","E-Mail has received on 25.10.21 asking for final prices. Already submitted  with three days.","2021-11-05","2021-10-28 16:56:09.237483","3011"
"2581","3638","2021-10-28","Changed in technical spec. Submitted offer for three days validity.","2021-11-01","2021-10-28 16:58:07.620718","3011"
"2582","2657","2021-10-28","After RA. Submitted offer of Rs.3.16 Cr. Finally closed at Rs.3 Cr.","2021-11-06","2021-11-11 18:58:09.547901","3011"
"2583","3472","2021-10-28","This inquiry is not closed yet. It shall take time to get finalised. They suggested after Diwali.","2021-10-28","2021-10-28 18:34:26.272263","3053"
"2584","16","2021-10-28","Against the same project. We have received the RFQ. Submitted offer.","2021-11-05","2021-10-28 18:44:53.564317","3011"
"2585","4144","2021-10-28","Commercial offer submitted / Under finalization","2021-10-30","2021-10-28 18:50:28.736847","3048"
"2586","4130","2021-10-28","Budgetary offer submitted / Under follow up","2021-11-09","2021-10-28 18:51:30.222313","3048"
"2587","4126","2021-10-28","Commercial offer submitted / Under follow up","2021-11-01","2021-10-28 18:52:22.817770","3048"
"2588","4091","2021-10-28","Offer submitted / Under follow up","2021-10-30","2021-10-28 19:00:28.599019","3048"
"2589","3956","2021-10-29","They will consider us for the finalization.","2021-11-15","2021-10-29 10:35:20.318748","3044"
"2590","4084","2021-10-29","It is a budgetary inquiry for JPDCL Project and  it shall take time of 4 months as they required prices on PV basis. We have quoted as per current LME and mentioned in the costing sheet bunch.","2022-02-03","2021-10-29 10:55:55.216640","3053"
"2591","4154","2021-10-29","  Offer has been submitted and we have discussed with client. They shall revert after checking and comparing our prices.  Now he require high temperature withstand cable up to 800 degree c ,600 v ,1.5 sq.mm. any conductor spc or npc.","2022-01-30","2021-10-29 10:59:32.673734","3053"
"2592","4153","2021-10-29"," Offer has been submitted, Our prices are on higher side, as they procure cables from Delhi.","2021-11-30","2021-10-29 11:00:33.987376","3053"
"2593","3947","2021-10-29","It will take time, they will intimate us before finalization.","2021-11-11","2021-10-29 12:18:31.061821","3044"
"2594","3736","2021-10-29","It will take time.","2021-11-23","2021-10-29 12:24:30.550905","3044"
"2595","3969","2021-10-29","It will take time.","2021-12-21","2021-10-29 16:55:32.724461","3044"
"2596","4141","2021-10-29","They will let us know about this.","2021-11-22","2021-10-30 10:23:57.051640","3044"
"2597","867","2021-10-29"," Not closed yet. ","2021-11-10","2021-10-29 17:18:28.094116","3033"
"2598","4099","2021-10-29","It is additional quantities.","2021-11-22","2021-10-29 17:21:04.502023","3044"
"2599","3249","2021-10-29","We have sent offer negotiation will take place.   ","2021-11-10","2021-10-29 17:31:32.205878","3033"
"2600","4147","2021-10-29","Offer has been submitted.","2021-10-30","2021-10-29 17:34:48.140823","3068"
"2601","3236","2021-10-29","Due to small very quantities they went with other Trader.  ","2021-10-07","2021-10-29 17:37:51.929935","3033"
"2602","2487","2021-10-29","Tenderis not opened yet ","2021-11-15","2021-10-29 18:06:23.104470","3033"
"2603","365","2021-10-30","Under follow up, No response from client for this budgetary offer.","2021-11-10","2021-10-30 09:41:55.873750","3048"
"2604","428","2021-10-30","Under follow up by mail.","2021-11-15","2021-10-30 09:50:20.196846","3048"
"2605","541","2021-10-30","It is under follow up by mail.","2021-11-15","2021-10-30 10:09:13.446116","3048"
"2606","4088","2021-10-30","They will intimate us.","2021-11-22","2021-10-30 10:29:40.525550","3044"
"2607","3937","2021-10-30","They will mail us for this.","2021-11-22","2021-10-30 10:37:08.409190","3044"
"2608","4041","2021-10-30"," Offer submitted will take time to open.   ","2021-11-30","2021-10-30 12:26:11.588674","3033"
"2609","4049","2021-10-30","Offer sent , technical review is being place. Under follow up. ","2021-11-15","2021-10-30 12:28:35.409633","3033"
"2610","877","2021-10-30","Under follow up / On hold","2021-11-10","2021-10-30 16:05:53.701688","3048"
"2611","836","2021-10-30","It is under follow up by mail.","2021-11-10","2021-10-30 16:21:18.487279","3048"
"2612","266","2021-11-01","They did not get this tender.","2021-11-17","2021-11-01 11:08:53.631246","3044"
"2613","3827","2021-11-01","Its pending form the their client end.","2021-11-23","2021-11-01 11:22:52.813627","3044"
"2614","4147","2021-11-02","Offer has been submitted. He require other cable in different technical specification.","2021-11-10","2021-11-02 10:28:54.020859","3068"
"2615","892","2021-11-02","It is under follow up by mail / Budgetary offer","2021-11-25","2021-11-02 12:26:29.175119","3048"
"2616","4176","2021-11-02"," Commercial offer submitted / Under follow up.","2021-11-15","2021-11-09 11:43:10.775501","3048"
"2617","4172","2021-11-02"," Commercial offer submitted / Under follow up","2021-11-15","2021-11-09 11:43:48.469528","3048"
"2618","4168","2021-11-02","Offer submitted / Under follow up","2021-11-10","2021-11-02 15:56:31.475640","3048"
"2619","4144","2021-11-02"," Under follow up","2021-11-15","2021-11-09 11:51:05.549708","3048"
"2620","4038","2021-11-02","An order confirmation is received on 02.11.21.","2021-11-05","2021-11-02 18:21:54.319816","3011"
"2621","3185","2021-11-02","  Lost it on high rates by 7% to 10% diff.","2021-11-10","2021-11-25 17:41:02.603263","3011"
"2622","1410","2021-09-01","Final offer was submitted after RA. LOA is received on 03.09.21","2021-11-15","2021-11-03 13:17:33.003764","3011"
"2623","4209","2021-11-09","commercial offer submitted / Yet to finalize / Under follow up.","2021-11-15","2021-11-09 11:36:08.377311","3048"
"2624","4201","2021-11-09","Commercial offer submitted / Under negotiation","2021-11-15","2021-11-09 11:37:49.534672","3048"
"2625","4195","2021-11-09","Commercial offer submitted / under follow up.","2021-11-15","2021-11-09 11:40:51.686870","3048"
"2626","4156","2021-11-09","Commercial offer submitted / It is under follow up","2021-11-15","2021-11-09 11:47:53.993579","3048"
"2627","2425","2021-11-09"," It is under follow up will take time will be surely informed. ","2021-12-01","2021-11-09 14:24:05.784305","3033"
"2628","2572","2021-11-09","RA was conducted by client on 02.11.21. We were not lowest. Hence we lost it.","2021-11-15","2021-11-09 17:08:38.174648","3011"
"2629","4117","2021-11-10","An Enquiry through Digneshbhai. Bidding stage for ONGC -T.N. Project.","2021-11-15","2021-11-10 14:46:46.657826","3011"
"2630","4166","2021-11-10","Technical provided as per clients requirement","2021-11-16","2021-11-10 15:09:37.744092","3048"
"2631","4143","2021-11-10","Budgetary offer submitted / Under follow up byRahul","2021-11-30","2021-11-10 15:10:51.463411","3048"
"2632","4130","2021-11-10","It is under follow up","2021-11-17","2021-11-10 15:11:11.532872","3048"
"2633","4126","2021-11-10","It is under follow up","2021-11-17","2021-11-10 15:16:05.925577","3048"
"2634","4074","2021-11-10","Commercial offer submitted / Under follow up","2021-11-17","2021-11-10 15:16:36.345923","3048"
"2635","4110","2021-11-10","Firm Requirements. Due to urgency they have procured from the stockiest.. Hence lost it.","2021-11-15","2021-11-10 16:02:28.413434","3011"
"2636","4129","2021-11-10","Firm Requirements. It is under technical review.","2021-11-15","2021-11-10 16:07:56.071823","3011"
"2637","4122","2021-11-10","Firm Requirements for UPJN Project. It is under technical evaluation.","2021-11-15","2021-11-10 17:12:24.658134","3011"
"2638","3619","2021-11-10","Send a reminder. Awaiting for response.","2021-11-15","2021-11-10 17:29:39.541913","3011"
"2639","4093","2021-11-10","On Line through SAP-Ariba Portal by Rahul.","2021-11-15","2021-11-10 18:02:52.314191","3011"
"2640","3646","2021-11-11","Firm Requirements for HPCL-VRMP Project. After technical clearance, Submitted Revised offer.","2021-11-20","2021-11-11 12:58:44.460157","3011"
"2641","4226","2021-11-11","commercial offer submitted / Under follow up","2021-11-18","2021-11-11 16:44:14.284952","3048"
"2642","4224","2021-11-11","Budgetary offer submitted","2021-11-18","2021-11-11 16:44:34.054915","3048"
"2643","4214","2021-11-11","Commercial offer submitted / Under finalization/ Under follow up","2021-11-18","2021-11-11 16:45:07.073148","3048"
"2644","4187","2021-11-11","Commercial offer submitted / Under follow up","2021-11-18","2021-11-11 16:45:44.467921","3048"
"2645","4067","2021-11-11","Firm Requirements for IOCL-Barauni Project.. It will finalize by next week.","2021-11-15","2021-11-11 18:13:41.201763","3011"
"2646","1457","2021-11-12","As discussed with Mr.Shekhar. Project kept on hold. No further information from end customer.","2021-11-30","2021-11-12 16:35:56.718451","3011"
"2647","4245","2021-11-16","Commercial offer submitted / Under follow up","2021-11-23","2021-11-16 10:28:30.386446","3048"
"2648","3904","2021-11-18","As discussed with Client , this small enquiry will be merged with other enquiry ( HPCL ) at the time of finalization.","2021-12-10","2021-11-18 14:26:50.547532","3048"
"2649","3638","2021-11-18","Final offer value of Rs.39.77 Lacs was submitted. It has closed at 35.00 Lacs. Lost on high rates.","2021-11-25","2021-11-18 15:02:36.029023","3011"
"2650","2481","2021-11-18","Project kept on hold. No further information.","2021-11-30","2021-11-18 16:14:12.466699","3011"
"2651","2136","2021-11-18","The same RFQ we have received from L","2021-11-30","2021-11-18 16:19:58.285713","3011"
"2652","2174","2021-11-18","Lost it on high rates.","2021-11-30","2021-11-18 16:43:46.413596","3011"
"2653","2331","2021-11-18","The said RFQ has kept on hold.","2021-11-30","2021-11-18 16:46:17.830658","3011"
"2654","4305","2021-11-18","    Offer Has been submitted. We have to provide 0.5 Sq.mm Fiber Glass Cable Sample.","2022-01-31","2021-11-18 17:09:48.767400","3068"
"2655","4307","2021-11-18"," Offer has been submitted. Rates are higher in some cable. He will send this cable on Watsh app.","2021-11-21","2021-11-26 10:26:50.420693","3068"
"2656","4325","2021-11-20"," Technical data sheet submitted as per clients requirement","2021-12-15","2021-11-30 11:31:56.285319","3048"
"2657","4306","2021-11-20","Offer has been submitted. we will disscuss in  production team for ss>tc percentage.","2021-11-24","2021-11-20 14:13:00.901835","3068"
"2658","3537","2021-11-22","Budgetory offer for IOCL-Kochi Terminal Project. AST has lost it. ABB -Bengaluru is the lowest bidder.","2021-11-30","2021-11-22 17:16:17.893625","3011"
"2659","4259","2021-11-25","Offer has been submitted and it is for a budgetary project of DAE. They only participate in DAE Tenders and are traders of different type of cables and accessories.","2022-01-05","2021-11-25 11:32:16.882845","3053"
"2660","4255","2021-11-25","budgetary offer for Africa CP project and the main contractor is not disclosed yet. They shall revert once the inquiry is about to close. They shall need some time to close this as discussed.","2021-12-15","2021-11-25 11:48:15.813754","3053"
"2661","4267","2021-11-25","Offer sent will take time.  ","2021-12-15","2021-11-25 14:45:00.208381","3033"
"2662","4222","2021-11-25","Has been submitted will take time. ","2022-01-01","2021-11-25 14:46:13.533547","3033"
"2663","4148","2021-11-25","To obtain the approval we have submitted offer. will update us under follow up.  ","2021-12-23","2021-11-25 14:47:44.726684","3033"
"2664","4357","2021-11-25","Budgetary offer submitted / Under follow up","2021-12-15","2021-11-25 15:01:34.186518","3048"
"2665","1330","2021-11-25","Very short lenth not closed yet. ","2021-12-01","2021-11-25 15:05:33.467596","3033"
"2666","4342","2021-11-25","under follow  for transformes  div they have finnalsed next 15 days ","2021-11-30","2021-11-25 15:40:04.687688","3007"
"2667","4311","2021-11-25","for submited they have finalsied next month ","2021-12-25","2021-11-25 15:41:02.565962","3007"
"2668","4310","2021-11-25","offer submitted they have finalised by 10 to 15 days under estimate  working ","2021-12-15","2021-11-25 15:41:48.607823","3007"
"2669","4309","2021-11-25","offer submitted  they have finalsed by take some time for Punjab PSPTCL PROJECT ","2021-12-10","2021-11-25 15:42:50.778737","3007"
"2670","3480","2021-11-25","Again submitted final offer on 16.11.21. Awaiting clearance from end customer.","2021-11-30","2021-11-25 17:26:08.094884","3011"
"2671","3211","2021-11-26","Discussed with Mr. S K Dhawan this offer shall take time till January to close as there is no response from their end client.","2022-01-01","2021-11-26 10:29:39.045700","3053"
"2672","4331","2021-11-26","Budgetary offer submitted it will take time","2021-12-15","2021-11-26 11:42:37.049661","3048"
"2673","4371","2021-11-26"," Offer Has been submitted . they  check our rate and he will give order depend on enquiry.","2021-11-29","2021-11-26 12:32:02.983588","3068"
"2674","4370","2021-11-26","Offer has been submitted. our rates are higher compare to other vendor.","2021-11-30","2021-11-26 12:34:49.306083","3068"
"2675","4365","2021-11-26","  Offer has been submitted. they will compare other vendor price then they will think about po.","2022-01-24","2021-11-26 12:42:24.406425","3068"
"2676","4307","2021-11-26"," He gave order on 19th november .","2022-01-31","2021-11-26 12:45:12.283290","3068"
"2677","4193","2021-11-26","They will intimate after 2 months.","2022-01-05","2021-11-26 15:50:36.394296","3044"
