"id","inqno","fdate","remark","ndate","datetime","user_id"
"1","1","2020-05-01","offer send ing by 25 march but vendor qty cahnage they have finalsed take some time ","2020-05-16","2020-05-01 00:00:00.000000","3007"
"2","2","2020-05-01","Budhetory Offer","2020-07-30","2020-05-01 00:00:00.000000","3000"
"3","3","2020-05-23","Firm Requirements. Lost it on high rates. Finally closed at 47Lac (Inc.of GST & Freight).","2020-06-02","2020-05-23 00:00:00.000000","3011"
"4","4","2020-05-26","Budgetory offer  ","2020-09-13","2020-05-26 00:00:00.000000","3007"
"5","5","2020-05-23","Budgetory offer. Metro Project. It will take time.","2020-07-22","2020-05-23 00:00:00.000000","3011"
"6","6","2020-05-23","Firm Requirements. E-Auction was conducted by HAIL. Lost it due to approval problem of specific project for Power cables.","2020-06-02","2020-05-23 00:00:00.000000","3011"
"7","7","2020-05-26","Budgetory Offer","2020-08-24","2020-05-26 00:00:00.000000","3007"
"8","8","2020-05-23","PO Received.","2020-06-02","2020-05-23 00:00:00.000000","3011"
"9","9","2020-07-04","This project on hold.","2020-07-19","2020-07-04 00:00:00.000000","3044"
"10","10","2020-05-26","Regret","0000-00-00","2020-05-26 00:00:00.000000","3033"
"11","11","2020-05-15","as discuss Hardik dated 15/05/20 Regert For same ","0000-00-00","2020-05-15 00:00:00.000000","3033"
"12","13","2020-06-17","Shall take time for 3 months","2020-08-16","2020-06-17 00:00:00.000000","3001"
"13","16","2020-05-23","Firm RFQ for Instrumentation cables. Lost it on high rates. Package finalized at 18Cr.","2020-06-02","2020-05-23 00:00:00.000000","3011"
"14","17","2020-11-24","Due to Lockdown it is affected to this tender , Tender opening date extented.","2020-12-24","2020-11-24 00:00:00.000000","3044"
"15","19","2020-05-12","Awaiting for finaal quantity from PDIL, Due to lockdown it is stuck. Will resume after lockdown. ","2020-05-27","2020-05-12 00:00:00.000000","3044"
"16","20","2020-06-23","take some time","2020-08-22","2020-06-23 00:00:00.000000","3007"
"17","21","2020-09-18","They will consider us for final negotiation,Under follow up. It will take more than 2 months.","2020-10-18","2020-09-18 00:00:00.000000","3044"
"18","23","2020-06-12","Tender has been submitted by them. ","2020-07-12","2020-06-12 00:00:00.000000","3033"
"19","24","2020-05-23","Firm Requirements. E-Auction was conducted by Adani. We were at Rank-3. Hence lost it.","2020-06-02","2020-05-23 00:00:00.000000","3011"
"20","25","2020-05-23","Firm Requirements for IOCL/BPCL Projects. Due to COVID-19 Lockdown issue not yet finalize.","2020-06-17","2020-05-23 00:00:00.000000","3011"
"21","27","2020-06-23","not decide take some time  he is call back ","2020-08-22","2020-06-23 00:00:00.000000","3007"
"22","28","2020-10-23","Budgetory offer , It will take time.","2020-11-22","2020-10-23 00:00:00.000000","3044"
"23","29","2020-05-23","Budgetory offer. Metro Project. It will take time.","2020-07-22","2020-05-23 00:00:00.000000","3011"
"24","30","2020-05-20","They provide different solutions I water industries","2020-06-19","2020-05-20 00:00:00.000000","3053"
"25","31","2020-06-12","Revised quantity has given by them. . ","2020-07-27","2020-06-12 00:00:00.000000","3033"
"26","32","2020-05-23","Firm Requirements for Railway project. Due to COVID-19 Lockdown issue not yet finalize.","2020-06-22","2020-05-23 00:00:00.000000","3011"
"27","34","2020-05-26","firm Requirment offer submited they have finalsed by shortly call back at final nefgotaion","2020-06-25","2020-05-26 00:00:00.000000","3007"
"28","35","2020-05-26","online tender submited by Rahul","2020-07-25","2020-05-26 00:00:00.000000","3039"
"29","36","2020-05-23","Firm Requirements. It is under follow-up by Parth P. ","2020-06-02","2020-05-23 00:00:00.000000","3048"
"30","38","2020-05-26","tender submited auction rquired ","2020-07-25","2020-05-26 00:00:00.000000","3003"
"31","39","2020-05-22","all ready qote sr no 132","0000-00-00","2020-05-22 00:00:00.000000","3007"
"32","41","2021-03-31","AS DISSCTION WITH RADHA RANI BHEL HEAD EVOLUTION AS UNDER PROCESSS ","2021-05-30","2021-03-31 00:00:00.000000","3003"
"33","44","2020-05-21","Tender Cancelled","0000-00-00","2020-05-21 00:00:00.000000","3039"
"34","54","2021-03-31","AS DISSCTION WITH RADHA RANI BHEL HEAD EVOLUTION AS UNDER PROCESSS ","2021-05-30","2021-03-31 00:00:00.000000","3003"
"35","61","2020-05-08","Budgetary offer submitted, will take time ","2020-08-06","2020-05-08 00:00:00.000000","3033"
"36","62","2020-05-23","Firm Requirements. It is under follow-up.","2020-06-02","2020-05-23 00:00:00.000000","3011"
"37","63","2020-05-23","On Line Tender.System.","2020-06-02","2020-05-23 00:00:00.000000","3011"
"38","64","2020-08-12","Due to small quantities , our price were higher side.","2020-08-27","2020-08-12 00:00:00.000000","3044"
"39","65","2020-05-23","Bidding Stage. It take time.","2020-06-22","2020-05-23 00:00:00.000000","3011"
"40","66","2020-05-08","Getting too much low rates from Shririam, CMI & Others , weare at L4  also expexting open credit payment. ","2020-05-28","2020-05-08 00:00:00.000000","3033"
"41","67","2020-05-20","Will take time. ","2020-07-19","2020-05-20 00:00:00.000000","3033"
"42","68","2020-08-19","nod  decided till hold","2020-10-18","2020-08-19 00:00:00.000000","3007"
"43","69","2020-08-19","Budgetory offer take some time","2020-12-17","2020-08-19 00:00:00.000000","3007"
"44","70","2020-08-19","due not response by vendor","0000-00-00","2020-08-19 00:00:00.000000","3007"
"45","82","2020-07-04","Budgetory offer , It will take time.","2020-08-03","2020-07-04 00:00:00.000000","3044"
"46","83","2020-08-19","Budgetory offer","2020-11-17","2020-08-19 00:00:00.000000","3007"
"47","84","2020-08-19","take some time","2020-12-17","2020-08-19 00:00:00.000000","3007"
"48","85","2020-05-20","They are manufacturer of transformer","2020-06-19","2020-05-20 00:00:00.000000","3053"
"49","86","2020-05-23","Bidding Stage. It take time.","2020-06-22","2020-05-23 00:00:00.000000","3011"
"50","87","2020-08-06","PO Received.","2020-08-16","2020-08-06 00:00:00.000000","3011"
"51","88","2020-09-05","bidding stage requirment take some time","0000-00-00","2020-09-05 00:00:00.000000","3007"
"52","89","2020-05-23","Firm Requirements. Due to COVID-19 Lockdown issue not yet decided. RA shall condut by Adani.","2020-06-07","2020-05-23 00:00:00.000000","3011"
"53","91","2020-05-08","Budgetary offer submitted, will take time ","2020-06-22","2020-05-08 00:00:00.000000","3033"
"54","98","2020-06-12","Project is under execution, However Ghana has also lockdown, will discuss on this after a week. ","2020-06-27","2020-06-12 00:00:00.000000","3033"
"55","99","2020-05-23","Bidding Stage. It take time.","2020-06-22","2020-05-23 00:00:00.000000","3011"
"56","102","2020-05-23","Firm Requirements.It is under technical evaluation. Call back next week.","2020-06-02","2020-05-23 00:00:00.000000","3011"
"57","103","2020-05-08","Budgetary offer submitted, will take time ","2020-06-22","2020-05-08 00:00:00.000000","3054"
"58","105","2020-05-22","Not quoted because of hard copy and all the courier service are not working","0000-00-00","2020-05-22 00:00:00.000000","3007"
"59","106","2020-05-08","Budgetary offer submitted, will take time ","2020-06-22","2020-05-08 00:00:00.000000","3048"
"60","107","2020-06-12","Budgetary offer is ubmitted, we need to get approval for this project , as we are not approved with worley . ","2020-07-12","2020-06-12 00:00:00.000000","3033"
"61","108","2020-06-22","It is a budgetary offer and tender has been extended due to lockdown.","2020-07-22","2020-06-22 00:00:00.000000","3053"
"62","109","2021-01-01","They did not get the tender and they found our prices high. New enquiries will be floated soon.","2021-02-20","2021-01-01 00:00:00.000000","3053"
"63","110","2020-05-12","Offer submitted, will be finalized after 2 weeks. ","2020-05-27","2020-05-12 00:00:00.000000","3033"
"64","112","2020-06-11","They proide turkey solution in coal handling plant, under follow up.","2020-07-11","2020-06-11 00:00:00.000000","3044"
"65","115","2020-05-22","small qty","0000-00-00","2020-05-22 00:00:00.000000","3007"
"66","120","2020-05-23","Bidding Stage. It take time.","2020-06-22","2020-05-23 00:00:00.000000","3011"
"67","122","2020-06-05","They will consider us for final negotitiation,Under follow up.","2020-06-20","2020-06-05 00:00:00.000000","3044"
"68","125","2020-05-19","DUE SMALL QTY REGERT","0000-00-00","2020-05-19 00:00:00.000000","3011"
"69","126","2020-05-22","small qty","0000-00-00","2020-05-22 00:00:00.000000","3003"
"70","127","2020-06-16","under technical evulationstage finalised by end of june 2020","2020-07-16","2020-06-16 00:00:00.000000","3007"
"71","133","2020-05-22","small qty","0000-00-00","2020-05-22 00:00:00.000000","3003"
"72","134","2020-05-19","regret du to all ready quoted to direct tender KSEB Online Against Sr 160","0000-00-00","2020-05-19 00:00:00.000000","3007"
"73","138","2020-06-03","yet to finalize. ","2020-07-18","2020-06-03 00:00:00.000000","3033"
"74","139","2020-06-03","yet to finalize.","2020-07-18","2020-06-03 00:00:00.000000","3033"
"75","140","2020-06-03","yet to finalize.","2020-07-18","2020-06-03 00:00:00.000000","3033"
"76","141","2020-06-03","Will take time for finalization. ","2020-07-18","2020-06-03 00:00:00.000000","3033"
"77","142","2020-06-03","Will take time for finalization. ","2020-07-18","2020-06-03 00:00:00.000000","3033"
"78","143","2020-06-03","Will take time for finalization.","2020-07-18","2020-06-03 00:00:00.000000","3033"
"79","144","2020-06-03","Will take time for finalization. ","2020-07-18","2020-06-03 00:00:00.000000","3033"
"80","145","2020-05-19","Need to make a regular follow ups. ","2020-06-18","2020-05-19 00:00:00.000000","3033"
"81","146","2020-05-29","small qty","0000-00-00","2020-05-29 00:00:00.000000","3039"
"82","148","2020-08-06","Bidding Stage. It take time.","2020-09-05","2020-08-06 00:00:00.000000","3011"
"83","150","2020-05-23","Firm Requirements.It is under technical evaluation. Call back next week.","2020-06-02","2020-05-23 00:00:00.000000","3011"
"84","153","2020-05-19","Will get the order. ","2020-06-03","2020-05-19 00:00:00.000000","3033"
"85","154","2020-05-23","We have received the same RFQ from Elster -Vadodara. It is under follow-up by Alvin.","2020-06-02","2020-05-23 00:00:00.000000","3011"
"86","156","2020-07-28","They are waiting for the final clearance, Under negotiation. ","2020-08-07","2020-07-28 00:00:00.000000","3048"
"87","158","2020-05-29","HT Cable","0000-00-00","2020-05-29 00:00:00.000000","3003"
"88","159","2020-05-19","Discussed with client we have to get approval. ","2020-06-18","2020-05-19 00:00:00.000000","3053"
"89","163","2020-05-20","They proivde automation solution in Pharma companies","2020-06-04","2020-05-20 00:00:00.000000","3048"
"90","164","2020-06-27","Commercial offer submitted, Budgetory offer will take time","2020-08-01","2020-06-27 00:00:00.000000","3048"
"91","165","2020-05-20","they provide Automation Solutions like PLC and SCADA","2020-06-19","2020-05-20 00:00:00.000000","3053"
"92","166","2020-06-11","repted sr no 248","0000-00-00","2020-06-11 00:00:00.000000","3003"
"93","167","2020-09-24","Project kept on hold. ","2020-10-24","2020-09-24 00:00:00.000000","3011"
"94","168","2020-08-12","They will consider us for final negotiation,Under follow up.","2020-08-27","2020-08-12 00:00:00.000000","3044"
"95","169","2020-06-16","auction required","2020-07-26","2020-06-16 00:00:00.000000","3007"
"96","172","2020-06-03","Technical compliance submitted , need to submit final rates. ","2020-06-10","2020-06-03 00:00:00.000000","3033"
"97","173","2020-05-26","as discuss rawal customer not Required offer only required GTP technical Clearance only after that they have issue to enquiry","0000-00-00","2020-05-26 00:00:00.000000","3050"
"98","176","2020-06-22","They did not get the tender and enquired about GETCO. New enquiry shall be received.","2020-07-22","2020-06-22 00:00:00.000000","3053"
"99","177","2020-08-06","Firm Requirements. It is under technical evaluation.","2020-08-21","2020-08-06 00:00:00.000000","3011"
"100","178","2020-06-05","We did not quoted whole BOQ, 132/- Rs given by Delton. Our rates were 147/- rs.","2020-06-15","2020-06-05 00:00:00.000000","3044"
"101","179","2020-06-11","They provide Onshore servives and subcontactor of das offshore,, will take time for tender closing","2020-07-11","2020-06-11 00:00:00.000000","3048"
"102","180","2020-06-05","This has already club with Sr. No. 277.","0000-00-00","2020-06-05 00:00:00.000000","3044"
"103","182","2020-05-22","Tender Cancelled","0000-00-00","2020-05-22 00:00:00.000000","3039"
"104","183","2020-05-22","Technical SE-4","0000-00-00","2020-05-22 00:00:00.000000","3039"
"105","184","2020-06-30","offer ahs been submitted, budgetory enquiry.","2020-08-14","2020-06-30 00:00:00.000000","3053"
"106","185","2020-06-22","They made a mistake in tender and lost it. However, will revert in new enquiries. Our prices were good.","2020-07-22","2020-06-22 00:00:00.000000","3053"
"107","186","2020-06-27","Commercial offer submitted ,revisede offer submitted as per their target value .finalization process will take 15-20 days","2020-08-06","2020-06-27 00:00:00.000000","3048"
"108","187","2020-06-12","Tender has been submitted by them. ","2020-07-27","2020-06-12 00:00:00.000000","3053"
"109","188","2020-07-18","They will intimate us at the time of site requirement.","2020-08-17","2020-07-18 00:00:00.000000","3044"
"110","189","2020-06-11","all reday quot sr no 252","0000-00-00","2020-06-11 00:00:00.000000","3039"
"111","190","2020-06-03","Under negotiation. ","2020-06-10","2020-06-03 00:00:00.000000","3033"
"112","191","2020-05-26","all ready qote sr no 157","0000-00-00","2020-05-26 00:00:00.000000","3003"
"113","192","2020-06-12","Will discuss in NEXT WEEK. ","2020-06-19","2020-06-12 00:00:00.000000","3033"
"114","194","2020-05-26","Budgetory offer","2020-08-24","2020-05-26 00:00:00.000000","3053"
"115","195","2020-08-06","On Line Tender.System.","2020-08-21","2020-08-06 00:00:00.000000","3039"
"116","198","2020-06-03","This will take 60 days for opening. ","2020-08-02","2020-06-03 00:00:00.000000","3033"
"117","199","2020-06-05","already quoted to against Sr No 17.","0000-00-00","2020-06-05 00:00:00.000000","3044"
"118","200","2020-06-11","Under folllow up , negotitation, our price is to high","2020-07-11","2020-06-11 00:00:00.000000","3048"
"119","201","2020-06-03","allredy quoted to against Sr No 218","0000-00-00","2020-06-03 00:00:00.000000","3039"
"120","202","2020-06-04","HT Cable","0000-00-00","2020-06-04 00:00:00.000000","3048"
"121","203","2020-06-23","firm requirment take some time under technicalevulation stage","2020-07-23","2020-06-23 00:00:00.000000","3007"
"122","204","2020-06-02","all ready qote sr no 213","0000-00-00","2020-06-02 00:00:00.000000","3048"
"123","206","2020-06-03","all ready qote sr no 241","0000-00-00","2020-06-03 00:00:00.000000","3039"
"124","207","2020-06-08","small qty","0000-00-00","2020-06-08 00:00:00.000000","3011"
"125","209","2020-06-16","Budgetory offer","2020-09-24","2020-06-16 00:00:00.000000","3007"
"126","213","2020-06-11","They privode automation services in oil gas sector","2020-07-11","2020-06-11 00:00:00.000000","3048"
"127","215","2020-06-22","Offer has been submitted and they are under follow up.","2020-07-02","2020-06-22 00:00:00.000000","3053"
"128","216","2020-06-03","They are quoting to IOCL Project. 
Will make a follow up. ","2020-07-18","2020-06-03 00:00:00.000000","3033"
"129","220","2020-06-13","They will check rates & inform us. ","2020-06-28","2020-06-13 00:00:00.000000","3053"
"130","224","2020-08-06","PO Received.","0000-00-00","2020-08-06 00:00:00.000000","3011"
"131","225","2020-06-23","as discuss to manoj sir under working take some time","2020-07-23","2020-06-23 00:00:00.000000","3007"
"132","227","2020-06-16","Regret","0000-00-00","2020-06-16 00:00:00.000000","3053"
"133","231","2020-06-11","Their on requirement for dahej plant, undr follow up for negotiation","2020-07-11","2020-06-11 00:00:00.000000","3044"
"134","232","2020-06-30","Thye provide water soution in different industries, ","2020-07-30","2020-06-30 00:00:00.000000","3053"
"135","234","2020-06-23","Budgetory offer","2020-09-21","2020-06-23 00:00:00.000000","3007"
"136","235","2020-06-11","They provide piprline servces in oil and sector, they will finaliaze the order in August","2020-07-26","2020-06-11 00:00:00.000000","3048"
"137","237","2020-06-05","They are takeing rates from other vendor for make comperitive.","2020-06-25","2020-06-05 00:00:00.000000","3044"
"138","238","2020-06-10","small qty","0000-00-00","2020-06-10 00:00:00.000000","3039"
"139","239","2020-06-27","Budgetory offer submitted. It will take time","2020-08-11","2020-06-27 00:00:00.000000","3048"
"140","240","2020-09-03","Commercial offer submitted, Under follow-up","2020-09-23","2020-09-03 00:00:00.000000","3053"
"141","256","2020-06-22","Offer has submitted however due to lockdown the tender is extended.","2020-07-12","2020-06-22 00:00:00.000000","3053"
"142","262","2020-06-03","Submitted offer for PVDF Cable will get the order. ","2020-06-10","2020-06-03 00:00:00.000000","3033"
"143","263","2020-08-12","They have taken this cable from their non moved stock .","2020-09-06","2020-08-12 00:00:00.000000","3044"
"144","265","2020-06-05","It will take time.","2020-07-05","2020-06-05 00:00:00.000000","3044"
"145","266","2020-06-30","offre has been submitted, budgetroy enquiry, we are not there In make list, on two vender are there in cables.","2020-08-14","2020-06-30 00:00:00.000000","3044"
"146","267","2020-06-12","Due to small quantity , it is very difficult for reduce rate. ","2020-07-12","2020-06-12 00:00:00.000000","3033"
"147","269","2021-01-08","Budgetory offer .it will take time.","2021-02-07","2021-01-08 00:00:00.000000","3044"
"148","273","2020-06-27","Budgetory offer submitted, it will take time .Under followup","2020-08-01","2020-06-27 00:00:00.000000","3048"
"149","275","2020-06-22","Offer has been submitted however the tender is extended due to lockdown.","2020-07-22","2020-06-22 00:00:00.000000","3053"
"150","277","2020-08-12","They are considering us for the final negotiation.","2020-08-27","2020-08-12 00:00:00.000000","3044"
"151","280","2020-06-11","offer has been submitted, and ill take time for closinf the tender","2020-07-21","2020-06-11 00:00:00.000000","3044"
"152","281","2020-08-12","We got the order,We have match up with rates. ","2020-09-06","2020-08-12 00:00:00.000000","3044"
"153","283","2020-06-22","The offer was for tender and tender is extended due to lockdown in Chennai. Is under follow up.","2020-07-22","2020-06-22 00:00:00.000000","3053"
"154","287","2020-12-02","PO Received.","0000-00-00","2020-12-02 00:00:00.000000","3011"
"155","288","2020-06-22","The tender expired before he could participate,also our prices were high and he wanted to enquire futher for new projects. New enquiry shall be received","2020-07-22","2020-06-22 00:00:00.000000","3053"
"156","289","2020-06-11","offer has been submitted and very small quantity.","2020-07-21","2020-06-11 00:00:00.000000","3053"
"157","291","2020-06-16","as discuss to niddhi they have 2to 3times reminder & call but customer is not clera the technical calfifcation as on 15.06.20 so I will reget fot same","0000-00-00","2020-06-16 00:00:00.000000","3033"
"158","294","2020-09-24","E-Auction was conducted by Adani. (Rank-3)","2020-10-04","2020-09-24 00:00:00.000000","3011"
"159","295","2020-08-12","They are considering us for the final negotiation.","2020-08-27","2020-08-12 00:00:00.000000","3044"
"160","298","2020-08-12","We got purchase order with increase quantity of the cables.","2020-09-11","2020-08-12 00:00:00.000000","3044"
"161","300","2020-11-24","They are considering us for the final negotiation. If they get this project.","2020-12-24","2020-11-24 00:00:00.000000","3044"
"162","304","2020-06-27","Budgetory offer submitted, it will take time .Under followup","2020-08-26","2020-06-27 00:00:00.000000","3054"
"163","305","2020-06-11","offer has been submitted and they will let us know when the tender will be close.","2020-07-21","2020-06-11 00:00:00.000000","3053"
"164","306","2020-07-04","They are tarder having requirement for their client. Under follow up. ","2020-08-03","2020-07-04 00:00:00.000000","3048"
"165","308","2020-06-11","offer has been submitted","2020-07-06","2020-06-11 00:00:00.000000","3048"
"166","309","2020-08-05","Firm Requirements. Call back next week.","2020-08-25","2020-08-05 00:00:00.000000","3011"
"167","312","2020-06-22","Offer has been submitted. They will revert after technical clearance. Is under follow up.","2020-07-02","2020-06-22 00:00:00.000000","3053"
"168","313","2020-06-24","Tender has been extended due to lockdown. They will revert once they get any information.","2020-07-14","2020-06-24 00:00:00.000000","3053"
"169","314","2020-06-29","Yet to finalize. ","2020-07-19","2020-06-29 00:00:00.000000","3033"
"170","315","2020-06-29","Yet to finalize. ","2020-07-19","2020-06-29 00:00:00.000000","3033"
"171","317","2020-06-23","offer has been submited, they wil inform us about the tender opening","2020-08-02","2020-06-23 00:00:00.000000","3033"
"172","318","2020-06-23","Tender enquiry, offer has been submitted , will inform about tender opening","2020-08-12","2020-06-23 00:00:00.000000","3048"
"173","319","2020-09-24","Budgetory offer. It will take time.","2020-10-24","2020-09-24 00:00:00.000000","3011"
"174","321","2020-06-23","Budgetory offer","2020-09-21","2020-06-23 00:00:00.000000","3007"
"175","322","2020-06-23","offer has been submitted, will take time for finalization and under follow up","2020-07-23","2020-06-23 00:00:00.000000","3053"
"176","323","2020-06-23","Budgetory offer","0000-00-00","2020-06-23 00:00:00.000000","3007"
"177","324","2020-06-23","offer is firm but this is additional qty and earlier supply to other vendor","2020-07-08","2020-06-23 00:00:00.000000","3007"
"178","326","2020-09-24","Lost it on high rates by 7%.","2020-10-14","2020-09-24 00:00:00.000000","3011"
"179","327","2020-06-26","Offer submitted to them, need to submit the technical data sheet, they will review the same inform us for order closing. ","2020-07-06","2020-06-26 00:00:00.000000","3033"
"180","329","2020-09-24","Lost it on high rates and approval problem of Power cables.","2020-10-14","2020-09-24 00:00:00.000000","3011"
"181","332","2020-06-27","Commercial offer submitted .finalization process will take 10-15 days","2020-08-06","2020-06-27 00:00:00.000000","3048"
"182","334","2020-06-27","Budgetory offer submitted. It will take time","2020-08-11","2020-06-27 00:00:00.000000","3048"
"183","335","2020-06-24","Offer has been submitted and they found the prices very high. They finally went with Polycab.","2020-07-24","2020-06-24 00:00:00.000000","3053"
"184","336","2020-06-27","Offer submitted .Yet to finalize.","2020-08-01","2020-06-27 00:00:00.000000","3048"
"185","338","2020-06-27","Budgetory offer submitted. It will take time","2020-08-11","2020-06-27 00:00:00.000000","3048"
"186","339","2020-06-27","Budgetory offer submitted. It will take time","2020-08-11","2020-06-27 00:00:00.000000","3048"
"187","340","2020-06-23","offer has been submitted, will take time for finalization and under follow up","2020-07-13","2020-06-23 00:00:00.000000","3044"
"188","341","2020-08-21","offer submited  take some time they have auction done iby next month","2020-09-20","2020-08-21 00:00:00.000000","3000"
"189","342","2020-08-21","offer submited but they have not clear enquiry decision take some time","2020-09-20","2020-08-21 00:00:00.000000","3007"
"190","343","2020-08-21","offer submited but they have not clear enquiry decision take some time","2020-09-20","2020-08-21 00:00:00.000000","3007"
"191","344","2020-11-24","They are considering us for the final negotiation. If they get this project.","2020-12-24","2020-11-24 00:00:00.000000","3044"
"192","346","2020-07-09","We have offered discount. Still not Lowest one. ","2020-07-24","2020-07-09 00:00:00.000000","3033"
"193","348","2020-06-27","Budgetory offer submitted. It will take time","2020-08-11","2020-06-27 00:00:00.000000","3048"
"194","349","2020-08-12","Gemscab got this tender.","2020-09-11","2020-08-12 00:00:00.000000","3044"
"195","350","2020-10-02","They are considering us for the final negotiation. If they get this project.","2020-11-01","2020-10-02 00:00:00.000000","3044"
"196","354","2020-06-27","Offer submitted, finalization process will take time","2020-08-06","2020-06-27 00:00:00.000000","3048"
"197","356","0000-00-00","Bidding Stage. It take time.","0000-00-00","0000-00-00 00:00:00.000000","3011"
"198","358","2020-06-30","Thye are into sugar automatin, budgetory enquiry, offer has been sumitted , they will receivve LOA from their client in 2-3 weeks","2020-07-30","2020-06-30 00:00:00.000000","3053"
"199","362","2020-07-16","Budgetory Offer submitted . It will take time","2020-08-10","2020-07-16 00:00:00.000000","3048"
"200","363","2020-07-01","Offer ahs been submitted , they will let us know about the approval and under follow up for the same.","2020-07-31","2020-07-01 00:00:00.000000","3044"
"201","364","2020-06-26","Tender has been extended up to 10th of July. Keep following. ","2020-07-26","2020-06-26 00:00:00.000000","3033"
"202","365","2020-07-16","Tender offer Submitted, It will take time","2020-08-20","2020-07-16 00:00:00.000000","3048"
"203","366","2020-06-30","Offer has been submitted and the they have participated in the tender. Awaiting the date of tender.","2020-07-15","2020-06-30 00:00:00.000000","3053"
